{
  "schema_version": "0.1.0",
  "id": "cua.shared.cdb-s02.conflicting-change-replan",
  "version": "1.0.0",
  "title": "CDB-S02: Conflicting-change replan",
  "authors": [
    {
      "name": "Cua AI"
    }
  ],
  "provenance": {
    "origin": "original",
    "sources_consulted": [
      {
        "title": "Cua Driver Bench design record: version 0.1 task portfolio (internal)",
        "purpose": "Required CDB-S02 workflow and graded outcome"
      },
      {
        "title": "Internal implementation issue: implement CDB-S02 conflicting-change replan",
        "purpose": "Scope and acceptance evidence"
      },
      {
        "title": "Cua Driver Bench schema and runtime evaluator contract",
        "purpose": "Manifest and evaluator lifecycle shape"
      },
      {
        "title": "A Cua-produced customer sample (abstract structure only)",
        "purpose": "Abstract workload properties only; no content, wording, data or implementation reused"
      }
    ],
    "third_party_material": false,
    "notes": "Independently implemented with structural inspiration; not strict clean-room. The customer sample informed only abstract workload structure. The scenario, wording, application identities, fixture data, identifiers, exact workflow, scheduling constraints, blocker flow, workbook, code, evaluator, oracle, UI copy, and tests are original. Similarity reviews passed 2026-08-15 and 2026-10-10; see PROVENANCE.md."
  },
  "instructions": "Read the tentative Lighthouse schedule in Copperfield Mail and the later authoritative revision in Signal Quay Chat. Reconcile Daymark Calendar and planning/lighthouse-replan.ods in LibreOffice Calc so they agree and every hard constraint holds. Preserve protected events and unrelated data. When a requested session is unschedulable, leave it off the calendar, mark it blocked in the workbook, and use Signal Quay Chat to record the requested structured blocker. See brief.md.",
  "variants": [
    {
      "id": "fixture.lighthouse",
      "fixture_artifacts": [
        {
          "path": "brief.md",
          "sha256": "0b4c4694b1ff1eaa8473ca1e0f2aaedeb1ec21b220883b5be7a948206ffe3998"
        },
        {
          "path": "reset/setup.py",
          "sha256": "fedc30ea50375862737461e1c30840657c50510e71dac2a95c34bb606c536de9"
        },
        {
          "path": "reset/verify.py",
          "sha256": "7ea95408a12e13bc46f246e8752acb153fe1a28ce0ffd6e1e93762c77483d1db"
        },
        {
          "path": "fixture/mail/messages.json",
          "sha256": "371b2eb4e409a793138f86edd9dcb038cf81d6de3b560fef47f06006b7ee189e"
        },
        {
          "path": "fixture/chat/messages.json",
          "sha256": "9019a563fcd4d54368a1ddbac137e057fdac2ab3046ad0020fa994da1ac3f277"
        },
        {
          "path": "fixture/chat/blockers.json",
          "sha256": "0b433ce2b65a3936d1f4783cd04cbab9afe51b62f5aebbb92833eb5f7fc39e3b"
        },
        {
          "path": "fixture/chat/audit.ndjson",
          "sha256": "e3b0c44298fc1c149afbf4c8996fb92427ae41e4649b934ca495991b7852b855"
        },
        {
          "path": "fixture/calendar/events.json",
          "sha256": "9bffa18e42aa77d1c35c685c0bf321cbb5a4543b3855620740e1866bd94d0878"
        },
        {
          "path": "fixture/planning/lighthouse-replan.ods",
          "sha256": "e233cae7c58a9f32dc9e05530437e6d30a0ef363ee67d7d5dd883eefe3760c85"
        },
        {
          "path": "apps/lighthouse-desk/main.js",
          "sha256": "9b1ba33cafde8114cdadf20306e8542839d47beaa1f2c137980049cdc69127cb"
        },
        {
          "path": "apps/lighthouse-desk/preload.js",
          "sha256": "98c0a85add1ed084ad510c6941306c2199db6c4b883c90332153056b051879a4"
        },
        {
          "path": "apps/lighthouse-desk/store.js",
          "sha256": "3169cda9658652c536ad2de789d75313f278c8132f75313f9d0aa80564d87794"
        },
        {
          "path": "apps/lighthouse-desk/package.json",
          "sha256": "e9e03a634c21412e6e8182ef383f178a60b6a998c7434f6759bbe485ad5afb82"
        },
        {
          "path": "apps/lighthouse-desk/package-lock.json",
          "sha256": "7f6041f96bff7c2ce118da24d42594ee36b02aa74b064740cd3092d48ab27ccb"
        },
        {
          "path": "apps/lighthouse-desk/renderer/index.html",
          "sha256": "a84ab1bdfd10a158a1f5a9c98a16afcc35519cb457c1c7a6719a6ed0f587e170"
        },
        {
          "path": "apps/lighthouse-desk/renderer/app.js",
          "sha256": "d5ff9e69e6ae75ca1c68948506b7e6a8f30df46ce6215f582c9776996ac2e77c"
        },
        {
          "path": "apps/lighthouse-desk/renderer/styles.css",
          "sha256": "eaefcf9e541f1817d5d356d1a0a8ab558182b0ae57bb6286921628c71343027c"
        },
        {
          "path": "apps/lighthouse-desk/tests/store.test.js",
          "sha256": "57f4159c958a91ee7a0670d99f88c58a92e1bc38d0bafb09443d3248d465aab7"
        },
        {
          "path": "platform/README.md",
          "sha256": "9805dcec9944680f08a9cdf5a52170c6b568550e1441f8956ec530eb2e892709"
        },
        {
          "path": "platform/launch.macos.json",
          "sha256": "027bad2bf67f9ebde17da53f652b527d574fdbff057aab284c9e0337844677db"
        },
        {
          "path": "platform/launch.windows.json",
          "sha256": "1b2d1d0aff33782ec541deeecffca25689b9f0a2027acaa6c91ef374f962669a"
        },
        {
          "path": "platform/launch.linux.json",
          "sha256": "a2680fd62410e3b6cf66fc0e9e4d4bf814189931438e429a26c55acbbd672b71"
        }
      ],
      "parameters": {
        "target_date": "2026-10-14",
        "timezone": "America/Chicago",
        "authoritative_revision": "RQ-88",
        "workspace_layout": {
          "mail": "mail",
          "chat": "chat",
          "calendar": "calendar",
          "planning": "planning"
        }
      }
    }
  ],
  "required_capabilities": [
    "observe.screen",
    "observe.accessibility",
    "observe.window-metadata",
    "act.pointer",
    "act.keyboard",
    "target.window"
  ],
  "observation_surfaces": [
    "screen",
    "accessibility",
    "window-system",
    "process",
    "filesystem"
  ],
  "network_policy": {
    "setup": {
      "mode": "deny"
    },
    "agent": {
      "mode": "deny"
    },
    "evaluation": {
      "mode": "deny"
    },
    "cleanup": {
      "mode": "deny"
    }
  },
  "limits": {
    "agent_seconds": 1800,
    "evaluator_seconds": 180
  },
  "side_effects": {
    "allowed": [
      {
        "scope": "workspace.calendar.targets",
        "description": "Create, update, or delete Lighthouse target events."
      },
      {
        "scope": "workspace.planning.schedule",
        "description": "Edit logical cells in the Schedule sheet."
      },
      {
        "scope": "workspace.chat.blockers",
        "description": "Record the requested structured blocker through Signal Quay Chat."
      },
      {
        "scope": "workspace.processes",
        "description": "Operate the three Electron surfaces and LibreOffice Calc."
      }
    ],
    "forbidden": [
      {
        "scope": "workspace.calendar.protected",
        "description": "Move, edit, or delete protected calendar holds."
      },
      {
        "scope": "workspace.mail",
        "description": "Change mail messages or metadata."
      },
      {
        "scope": "workspace.chat.messages",
        "description": "Change chat messages or leave an internally inconsistent blocker audit."
      },
      {
        "scope": "workspace.planning.controls",
        "description": "Change workbook controls, sheet names, or unrelated structure."
      },
      {
        "scope": "network.external",
        "description": "Reach any non-loopback host."
      }
    ]
  },
  "evaluator": {
    "entrypoint": "evaluator/evaluate.py",
    "inputs": [
      {
        "path": "evaluator/evaluate.py",
        "sha256": "4b66001d1c7051d565959fe2d1e5c3f078bc2a3e430ab81c2db7e0890bf62de9"
      },
      {
        "path": "evaluator/ods.py",
        "sha256": "27f8cd5c532493f59e0f515c6e24bcd286c70bc57bd1f43a58df69e384454a37"
      },
      {
        "path": "evaluator/oracle.json",
        "sha256": "828cfebc9d919bac11811d045dabb03d3975aa4a67d9e6a36450d967a679655e"
      }
    ],
    "staging": "agent-inaccessible",
    "oracle": {
      "required": true,
      "staging": "before-setup"
    }
  },
  "reset": {
    "entrypoint": "reset/setup.py",
    "verification": {
      "entrypoint": "reset/verify.py",
      "timeout_seconds": 30
    },
    "failure_fixtures": [
      {
        "id": "reset.stale-calendar",
        "artifact": {
          "path": "reset/failure-fixtures/stale-calendar.json",
          "sha256": "f7e320681a0b6a80d84afd836ebfeb50195f950c6adab8b173ef0cc1747c5a30"
        },
        "expected_failure": "reset verification detects a stale calendar edit"
      },
      {
        "id": "reset.stale-blocker",
        "artifact": {
          "path": "reset/failure-fixtures/stale-blocker.json",
          "sha256": "c8ff858e755cff698a6cef4cb6ca607d3c8030a76d467abb8f077ebb3dad6645"
        },
        "expected_failure": "reset verification detects a blocker from a prior trial"
      }
    ]
  }
}
